{
  "$schema": "../../../schema/component.schema.json",
  "schema_version": "0.1.0",
  "id": "component:ti:PCA9306DCTR",
  "identity": {
    "manufacturer": "Texas Instruments",
    "manufacturer_slug": "ti",
    "mpn": "PCA9306DCTR",
    "series": "PCA9306",
    "orderable": null,
    "orderable_checked_on": null
  },
  "classification": {
    "category": "interface",
    "function": "dual bidirectional I2C and SMBus voltage-level translator",
    "keywords": [
      "I2C",
      "SMBus",
      "level translator",
      "bidirectional",
      "SSOP-8"
    ]
  },
  "sources": [
    {
      "id": "source:ti:SCPS113O",
      "kind": "datasheet",
      "publisher": "Texas Instruments",
      "title": "PCA9306 Dual Bidirectional I2C Bus and SMBus Voltage-Level Translator",
      "url": "https://www.ti.com/lit/ds/symlink/pca9306.pdf",
      "document_number": "SCPS113O",
      "revision": "Rev. O",
      "published_date": "2023-09-06",
      "retrieved_at": "2026-07-13T12:06:17Z",
      "retrieval_status": "captured-and-hashed",
      "sha256": "201618185d23e88bf7a7c77a3fa3d3feaad41351b0603906512c3bfa4958db18",
      "byte_size": 1546908,
      "page_count": 38,
      "redistributed": false,
      "locators": [
        {
          "page": 4,
          "label": "DCT pin configuration and functions"
        },
        {
          "page": 5,
          "label": "Recommended operating conditions"
        },
        {
          "page": 17,
          "label": "Application information"
        },
        {
          "page": 27,
          "label": "DCT package drawing and land pattern"
        }
      ]
    }
  ],
  "electrical": {
    "pins": [
      {
        "number": "1",
        "name": "GND",
        "function": "Ground.",
        "locator": "page 4, Pin Configuration and Functions",
        "source_id": "source:ti:SCPS113O"
      },
      {
        "number": "2",
        "name": "VREF1",
        "function": "Lower-voltage reference supply.",
        "locator": "page 4, Pin Functions",
        "source_id": "source:ti:SCPS113O"
      },
      {
        "number": "3",
        "name": "SCL1",
        "function": "Lower-voltage-side clock channel.",
        "locator": "page 4, Pin Functions",
        "source_id": "source:ti:SCPS113O"
      },
      {
        "number": "4",
        "name": "SDA1",
        "function": "Lower-voltage-side data channel.",
        "locator": "page 4, Pin Functions",
        "source_id": "source:ti:SCPS113O"
      },
      {
        "number": "5",
        "name": "SDA2",
        "function": "Higher-voltage-side data channel.",
        "locator": "page 4, Pin Functions",
        "source_id": "source:ti:SCPS113O"
      },
      {
        "number": "6",
        "name": "SCL2",
        "function": "Higher-voltage-side clock channel.",
        "locator": "page 4, Pin Functions",
        "source_id": "source:ti:SCPS113O"
      },
      {
        "number": "7",
        "name": "VREF2",
        "function": "Higher-voltage reference and bias node.",
        "locator": "page 4, Pin Functions",
        "source_id": "source:ti:SCPS113O"
      },
      {
        "number": "8",
        "name": "EN",
        "function": "Active-high translator enable.",
        "locator": "page 4, Pin Functions",
        "source_id": "source:ti:SCPS113O"
      }
    ],
    "ratings": [
      {
        "name": "VREF1",
        "value": {
          "min": 1.2,
          "max": 3.3
        },
        "unit": "V",
        "qualifier": "Recommended lower-side reference range.",
        "locator": "page 5, Recommended Operating Conditions",
        "source_id": "source:ti:SCPS113O"
      },
      {
        "name": "VREF2",
        "value": {
          "min": 1.8,
          "max": 5.5
        },
        "unit": "V",
        "qualifier": "Recommended higher-side reference range with VREF1 <= VREF2.",
        "locator": "page 5, Recommended Operating Conditions",
        "source_id": "source:ti:SCPS113O"
      },
      {
        "name": "bus frequency",
        "value": {
          "max": 0.4
        },
        "unit": "MHz",
        "qualifier": "I2C/SMBus operating headline; pull-ups and capacitance still determine rise time.",
        "locator": "page 1, Features",
        "source_id": "source:ti:SCPS113O"
      }
    ],
    "internally_common_terminal_groups": []
  },
  "package": {
    "name": "SSOP-8",
    "manufacturer_code": "DCT",
    "mounting": "surface-mount",
    "pin_count": 8,
    "pitch_mm": 0.65,
    "body_dimensions_mm": {
      "length": {
        "typ": 2.95
      },
      "width": {
        "typ": 4.0
      },
      "height": {
        "max": 1.3
      }
    },
    "land_pattern": {
      "status": "manufacturer-dimensioned",
      "source_id": "source:ti:SCPS113O",
      "locator": "DCT package drawing and land pattern",
      "pad_count": 8,
      "dimensions_mm": {},
      "coordinate_convention": null
    }
  },
  "cad": {
    "symbol": {
      "status": "not-included",
      "path": null,
      "manufacturing_use": false,
      "provenance": "No rights-cleared and independently reviewed native asset is distributed for this record.",
      "reference": null,
      "reason": "A symbol must be checked against the exact package and source before manufacturing use."
    },
    "footprint": {
      "status": "not-included",
      "path": null,
      "manufacturing_use": false,
      "provenance": "No rights-cleared and independently reviewed native asset is distributed for this record.",
      "reference": null,
      "reason": "A footprint must be checked against the exact package and source before manufacturing use."
    },
    "step_model": {
      "status": "not-included",
      "path": null,
      "manufacturing_use": false,
      "provenance": "No rights-cleared and independently reviewed native asset is distributed for this record.",
      "reference": null,
      "reason": "A STEP model must be checked against the exact package and source before manufacturing use."
    }
  },
  "assembly": {
    "process": "surface-mount reflow",
    "packing": {
      "method": null,
      "quantity": null,
      "source_id": null,
      "locator": null
    },
    "orientation": {
      "status": "partial",
      "description": "Pin-one or terminal orientation is documented; tape-pocket rotation and assembly-machine convention are not qualified here.",
      "source_id": "source:ti:SCPS113O",
      "locator": "DCT package drawing and land pattern"
    },
    "notes": [
      "Enforce VREF1 <= VREF2 and follow the recommended 200 kOhm bias connection.",
      "Calculate pull-ups from bus capacitance, sink current, and timing requirements."
    ]
  },
  "validation": {
    "evidence_state": "extracted",
    "physical_state": "not-tested",
    "release_state": "reference-only",
    "reviewed_on": "2026-07-13",
    "checks": [
      {
        "name": "official source identity",
        "status": "pass",
        "method": "Reviewed the official manufacturer document and recorded its revision, locators, retrieval state, and hash when byte capture succeeded.",
        "date": "2026-07-13"
      },
      {
        "name": "pin and package extraction",
        "status": "pass",
        "method": "Compared the package-specific pin map with the manufacturer pin table and package section.",
        "date": "2026-07-13"
      },
      {
        "name": "independent engineering review",
        "status": "open",
        "method": "No second human review, specimen inspection, footprint fit, assembly trial, or electrical qualification belongs to this record yet.",
        "date": "2026-07-13"
      }
    ],
    "known_issues": [
      {
        "severity": "design-risk",
        "scope": "component",
        "summary": "This pass-FET translator requires the correct VREF bias network and pull-ups on both sides; treating it as a push-pull logic translator can hold the bus at invalid levels.",
        "status": "documented"
      }
    ]
  },
  "rights": {
    "repository_content_license": "MIT",
    "source_files_redistributed": false,
    "normalized_record_origin": "Original Lyon Industries normalization based on the linked official manufacturer source.",
    "source_rights_status": "linked-only"
  }
}
