{
  "$schema": "../../../schema/component.schema.json",
  "schema_version": "0.1.0",
  "id": "component:ti:ADS1115IDGSR",
  "identity": {
    "manufacturer": "Texas Instruments",
    "manufacturer_slug": "ti",
    "mpn": "ADS1115IDGSR",
    "series": "ADS1115",
    "orderable": null,
    "orderable_checked_on": null
  },
  "classification": {
    "category": "data-converter",
    "function": "16-bit four-channel delta-sigma ADC with I2C interface",
    "keywords": [
      "ADC",
      "16-bit",
      "I2C",
      "four channel",
      "VSSOP-10"
    ]
  },
  "sources": [
    {
      "id": "source:ti:SBAS444E",
      "kind": "datasheet",
      "publisher": "Texas Instruments",
      "title": "ADS111x 16-Bit I2C-Compatible ADCs",
      "url": "https://www.ti.com/lit/ds/symlink/ads1115.pdf",
      "document_number": "SBAS444E",
      "revision": "Rev. E",
      "published_date": null,
      "retrieved_at": "2026-07-13T12:06:17Z",
      "retrieval_status": "captured-and-hashed",
      "sha256": "5fe00cf9509daba7ca311cd0a461debc563dd57598c5de3bf9c31903dc2238da",
      "byte_size": 2654262,
      "page_count": 57,
      "redistributed": false,
      "locators": [
        {
          "page": 3,
          "label": "DGS pin configuration and functions"
        },
        {
          "page": 4,
          "label": "Recommended operating conditions"
        },
        {
          "page": 28,
          "label": "Application information"
        },
        {
          "page": 45,
          "label": "DGS package drawing and land pattern"
        }
      ]
    }
  ],
  "electrical": {
    "pins": [
      {
        "number": "1",
        "name": "ADDR",
        "function": "I2C target-address select.",
        "locator": "page 3, Table 4-1",
        "source_id": "source:ti:SBAS444E"
      },
      {
        "number": "2",
        "name": "ALERT/RDY",
        "function": "Open-drain comparator or conversion-ready output.",
        "locator": "page 3, Table 4-1",
        "source_id": "source:ti:SBAS444E"
      },
      {
        "number": "3",
        "name": "GND",
        "function": "Ground.",
        "locator": "page 3, Table 4-1",
        "source_id": "source:ti:SBAS444E"
      },
      {
        "number": "4",
        "name": "AIN0",
        "function": "Analog input 0.",
        "locator": "page 3, Table 4-1",
        "source_id": "source:ti:SBAS444E"
      },
      {
        "number": "5",
        "name": "AIN1",
        "function": "Analog input 1.",
        "locator": "page 3, Table 4-1",
        "source_id": "source:ti:SBAS444E"
      },
      {
        "number": "6",
        "name": "AIN2",
        "function": "Analog input 2.",
        "locator": "page 3, Table 4-1",
        "source_id": "source:ti:SBAS444E"
      },
      {
        "number": "7",
        "name": "AIN3",
        "function": "Analog input 3.",
        "locator": "page 3, Table 4-1",
        "source_id": "source:ti:SBAS444E"
      },
      {
        "number": "8",
        "name": "VDD",
        "function": "Power supply.",
        "locator": "page 3, Table 4-1",
        "source_id": "source:ti:SBAS444E"
      },
      {
        "number": "9",
        "name": "SDA",
        "function": "I2C serial data.",
        "locator": "page 3, Table 4-1",
        "source_id": "source:ti:SBAS444E"
      },
      {
        "number": "10",
        "name": "SCL",
        "function": "I2C serial clock.",
        "locator": "page 3, Table 4-1",
        "source_id": "source:ti:SBAS444E"
      }
    ],
    "ratings": [
      {
        "name": "supply voltage",
        "value": {
          "min": 2.0,
          "max": 5.5
        },
        "unit": "V",
        "qualifier": "Recommended operating range.",
        "locator": "page 4, Section 5.3",
        "source_id": "source:ti:SBAS444E"
      },
      {
        "name": "resolution",
        "value": {
          "typ": 16
        },
        "unit": "bit",
        "qualifier": "ADC nominal resolution.",
        "locator": "page 1, Features",
        "source_id": "source:ti:SBAS444E"
      },
      {
        "name": "data rate",
        "value": {
          "min": 8,
          "max": 860
        },
        "unit": "SPS",
        "qualifier": "Programmable conversion rate.",
        "locator": "page 1 and data-rate section",
        "source_id": "source:ti:SBAS444E"
      }
    ],
    "internally_common_terminal_groups": []
  },
  "package": {
    "name": "VSSOP-10",
    "manufacturer_code": "DGS",
    "mounting": "surface-mount",
    "pin_count": 10,
    "pitch_mm": 0.5,
    "body_dimensions_mm": {
      "length": {
        "typ": 3.0
      },
      "width": {
        "typ": 3.0
      },
      "height": {
        "max": 1.1
      }
    },
    "land_pattern": {
      "status": "manufacturer-dimensioned",
      "source_id": "source:ti:SBAS444E",
      "locator": "DGS package drawing and land pattern",
      "pad_count": 10,
      "dimensions_mm": {},
      "coordinate_convention": null
    }
  },
  "cad": {
    "symbol": {
      "status": "not-included",
      "path": null,
      "manufacturing_use": false,
      "provenance": "No rights-cleared and independently reviewed native asset is distributed for this record.",
      "reference": null,
      "reason": "A symbol must be checked against the exact package and source before manufacturing use."
    },
    "footprint": {
      "status": "not-included",
      "path": null,
      "manufacturing_use": false,
      "provenance": "No rights-cleared and independently reviewed native asset is distributed for this record.",
      "reference": null,
      "reason": "A footprint must be checked against the exact package and source before manufacturing use."
    },
    "step_model": {
      "status": "not-included",
      "path": null,
      "manufacturing_use": false,
      "provenance": "No rights-cleared and independently reviewed native asset is distributed for this record.",
      "reference": null,
      "reason": "A STEP model must be checked against the exact package and source before manufacturing use."
    }
  },
  "assembly": {
    "process": "surface-mount reflow",
    "packing": {
      "method": null,
      "quantity": null,
      "source_id": null,
      "locator": null
    },
    "orientation": {
      "status": "partial",
      "description": "Pin-one or terminal orientation is documented; tape-pocket rotation and assembly-machine convention are not qualified here.",
      "source_id": "source:ti:SBAS444E",
      "locator": "DGS package drawing and land pattern"
    },
    "notes": [
      "Check common-mode and absolute input limits for every multiplexer selection.",
      "Provide pull-ups and a defined state for ADDR and ALERT/RDY as required."
    ]
  },
  "validation": {
    "evidence_state": "extracted",
    "physical_state": "not-tested",
    "release_state": "reference-only",
    "reviewed_on": "2026-07-13",
    "checks": [
      {
        "name": "official source identity",
        "status": "pass",
        "method": "Reviewed the official manufacturer document and recorded its revision, locators, retrieval state, and hash when byte capture succeeded.",
        "date": "2026-07-13"
      },
      {
        "name": "pin and package extraction",
        "status": "pass",
        "method": "Compared the package-specific pin map with the manufacturer pin table and package section.",
        "date": "2026-07-13"
      },
      {
        "name": "independent engineering review",
        "status": "open",
        "method": "No second human review, specimen inspection, footprint fit, assembly trial, or electrical qualification belongs to this record yet.",
        "date": "2026-07-13"
      }
    ],
    "known_issues": [
      {
        "severity": "design-risk",
        "scope": "component",
        "summary": "The programmable full-scale range does not permit analog inputs beyond the supply rails; confusing PGA range with absolute input limits can damage the ADC or corrupt readings.",
        "status": "documented"
      }
    ]
  },
  "rights": {
    "repository_content_license": "MIT",
    "source_files_redistributed": false,
    "normalized_record_origin": "Original Lyon Industries normalization based on the linked official manufacturer source.",
    "source_rights_status": "linked-only"
  }
}
