{
  "$schema": "../../../schema/component.schema.json",
  "schema_version": "0.1.0",
  "id": "component:microchip:MCP73831T-2ACI/OT",
  "identity": {
    "manufacturer": "Microchip Technology",
    "manufacturer_slug": "microchip",
    "mpn": "MCP73831T-2ACI/OT",
    "series": "MCP73831/2",
    "orderable": null,
    "orderable_checked_on": null
  },
  "classification": {
    "category": "battery-management",
    "function": "single-cell Li-ion and Li-polymer linear charger",
    "keywords": [
      "Li-ion",
      "charger",
      "500 mA",
      "SOT-23-5",
      "linear"
    ]
  },
  "sources": [
    {
      "id": "source:microchip:DS20001984H",
      "kind": "datasheet",
      "publisher": "Microchip Technology",
      "title": "MCP73831/MCP73832 Data Sheet",
      "url": "https://www.microchip.com/content/dam/mchp/documents/APID/ProductDocuments/DataSheets/MCP73831-Family-Data-Sheet-DS20001984H.pdf",
      "document_number": "DS20001984H",
      "revision": "Rev. H",
      "published_date": null,
      "retrieved_at": "2026-07-13T12:06:17Z",
      "retrieval_status": "browser-reviewed-byte-capture-blocked",
      "sha256": null,
      "byte_size": null,
      "page_count": 29,
      "redistributed": false,
      "locators": [
        {
          "page": 1,
          "label": "SOT-23-5 pinout"
        },
        {
          "page": 3,
          "label": "Electrical characteristics"
        },
        {
          "page": 11,
          "label": "Pin descriptions and application circuit"
        },
        {
          "page": 24,
          "label": "SOT-23 package drawing"
        }
      ]
    }
  ],
  "electrical": {
    "pins": [
      {
        "number": "1",
        "name": "STAT",
        "function": "Open-drain charge-status output.",
        "locator": "page 1, SOT-23-5 Package Types; pin descriptions",
        "source_id": "source:microchip:DS20001984H"
      },
      {
        "number": "2",
        "name": "VSS",
        "function": "Ground.",
        "locator": "page 1, SOT-23-5 Package Types; pin descriptions",
        "source_id": "source:microchip:DS20001984H"
      },
      {
        "number": "3",
        "name": "VBAT",
        "function": "Battery charge-current output and voltage-sense node.",
        "locator": "page 1, SOT-23-5 Package Types; pin descriptions",
        "source_id": "source:microchip:DS20001984H"
      },
      {
        "number": "4",
        "name": "VDD",
        "function": "Input supply.",
        "locator": "page 1, SOT-23-5 Package Types; pin descriptions",
        "source_id": "source:microchip:DS20001984H"
      },
      {
        "number": "5",
        "name": "PROG",
        "function": "Charge-current programming and shutdown input.",
        "locator": "page 1, SOT-23-5 Package Types; pin descriptions",
        "source_id": "source:microchip:DS20001984H"
      }
    ],
    "ratings": [
      {
        "name": "input voltage",
        "value": {
          "min": 3.75,
          "max": 6.0
        },
        "unit": "V",
        "qualifier": "Specified supply range.",
        "locator": "page 3, DC Characteristics",
        "source_id": "source:microchip:DS20001984H"
      },
      {
        "name": "regulated battery voltage",
        "value": {
          "min": 4.168,
          "typ": 4.2,
          "max": 4.232
        },
        "unit": "V",
        "qualifier": "-2 voltage option under stated conditions.",
        "locator": "page 3, DC Characteristics",
        "source_id": "source:microchip:DS20001984H"
      },
      {
        "name": "programmable charge current",
        "value": {
          "max": 0.5
        },
        "unit": "A",
        "qualifier": "Headline maximum; thermal regulation can reduce current.",
        "locator": "page 1 and application section",
        "source_id": "source:microchip:DS20001984H"
      }
    ],
    "internally_common_terminal_groups": []
  },
  "package": {
    "name": "SOT-23-5",
    "manufacturer_code": "OT",
    "mounting": "surface-mount",
    "pin_count": 5,
    "pitch_mm": 0.95,
    "body_dimensions_mm": {
      "length": {
        "typ": 3.1
      },
      "height": {
        "max": 1.45
      },
      "overall_width": {
        "typ": 2.8
      },
      "molded_width": {
        "typ": 1.6
      }
    },
    "land_pattern": {
      "status": "manufacturer-dimensioned",
      "source_id": "source:microchip:DS20001984H",
      "locator": "SOT-23 package drawing and recommended land pattern",
      "pad_count": 5,
      "dimensions_mm": {},
      "coordinate_convention": null
    }
  },
  "cad": {
    "symbol": {
      "status": "not-included",
      "path": null,
      "manufacturing_use": false,
      "provenance": "No rights-cleared and independently reviewed native asset is distributed for this record.",
      "reference": null,
      "reason": "A symbol must be checked against the exact package and source before manufacturing use."
    },
    "footprint": {
      "status": "not-included",
      "path": null,
      "manufacturing_use": false,
      "provenance": "No rights-cleared and independently reviewed native asset is distributed for this record.",
      "reference": null,
      "reason": "A footprint must be checked against the exact package and source before manufacturing use."
    },
    "step_model": {
      "status": "not-included",
      "path": null,
      "manufacturing_use": false,
      "provenance": "No rights-cleared and independently reviewed native asset is distributed for this record.",
      "reference": null,
      "reason": "A STEP model must be checked against the exact package and source before manufacturing use."
    }
  },
  "assembly": {
    "process": "surface-mount reflow",
    "packing": {
      "method": null,
      "quantity": null,
      "source_id": null,
      "locator": null
    },
    "orientation": {
      "status": "partial",
      "description": "Pin-one or terminal orientation is documented; tape-pocket rotation and assembly-machine convention are not qualified here.",
      "source_id": "source:microchip:DS20001984H",
      "locator": "SOT-23 package drawing and recommended land pattern"
    },
    "notes": [
      "Set PROG from the thermal envelope, not only the desired charge time.",
      "Validate cell chemistry, protection, temperature monitoring, and source-current limits at system level."
    ]
  },
  "validation": {
    "evidence_state": "extracted",
    "physical_state": "not-tested",
    "release_state": "reference-only",
    "reviewed_on": "2026-07-13",
    "checks": [
      {
        "name": "official source identity",
        "status": "pass",
        "method": "Reviewed the official manufacturer document and recorded its revision, locators, retrieval state, and hash when byte capture succeeded.",
        "date": "2026-07-13"
      },
      {
        "name": "pin and package extraction",
        "status": "pass",
        "method": "Compared the package-specific pin map with the manufacturer pin table and package section.",
        "date": "2026-07-13"
      },
      {
        "name": "independent engineering review",
        "status": "open",
        "method": "No second human review, specimen inspection, footprint fit, assembly trial, or electrical qualification belongs to this record yet.",
        "date": "2026-07-13"
      }
    ],
    "known_issues": [
      {
        "severity": "design-risk",
        "scope": "component",
        "summary": "Charge current is thermally regulated and this suffix has no battery-temperature input or safety timer; cell protection and system-level charge safety remain external design requirements.",
        "status": "documented"
      }
    ]
  },
  "rights": {
    "repository_content_license": "MIT",
    "source_files_redistributed": false,
    "normalized_record_origin": "Original Lyon Industries normalization based on the linked official manufacturer source.",
    "source_rights_status": "linked-only"
  }
}
